{
  "$schema": "http://json-schema.org/draft-07/schema#",
  "title": "MiniGameDefinitions",
  "type": "array",
  "items": {
    "type": "object",
    "properties": {
      "Id": {
        "type": "string",
        "format": "uuid",
        "description": "Unique identifier for the mini game definition"
      },
      "Description": {
        "type": "string",
        "description": "Description of the mini game"
      },
      "Type": {
        "type": "integer",
        "description": "Type of the mini game (enum value)"
      },
      "CreatedAt": {
        "type": ["string", "null"],
        "format": "date-time",
        "description": "Creation date of the mini game definition"
      },
      "UpdatedAt": {
        "type": ["string", "null"],
        "format": "date-time",
        "description": "Last update date of the mini game definition"
      },
      "ArchivedAt": {
        "type": ["string", "null"],
        "format": "date-time",
        "description": "Archival date of the mini game definition"
      },
      "Archived": {
        "type": "boolean",
        "description": "Indicates if the mini game definition is archived"
      },
      "DefinitionJsonData": {
        "type": "object",
        "description": "JSON data containing the definition of the mini game"
      }
    },
    "required": ["Id", "Description", "Type", "DefinitionJsonData"]
  }
}
