[
  {
    "Id": "d2f1e8a1-4b6e-4c3a-9f8e-1a2b3c4d5e6f",
    "Description": "Sample mini game description",
    "Type": 1,
    "CreatedAt": "2023-10-01T12:00:00Z",
    "UpdatedAt": null,
    "ArchivedAt": null,
    "Archived": false,
    "DefinitionJsonData": {
      "Rounds": [
        {
          "Id": "round_01",
          "Categories": [
            {
              "Id": "category_01",
              "Name": "Sport",
              "Questions": [
                {
                  "Id": "question_01",
                  "Text": "Kto wygrał mistrzostwa europy w piłce nożnej w 2008 roku?",
                  "Answers": [
                    {
                      "Id": "answer_01",
                      "Text": "Hiszpania",
                      "IsCorrect": true
                    },
                    {
                      "Id": "answer_02",
                      "Text": "Niemcy",
                      "IsCorrect": false
                    },
                    {
                      "Id": "answer_03",
                      "Text": "Polska",
                      "IsCorrect": false
                    },
                    {
                      "Id": "answer_04",
                      "Text": "Austria",
                      "IsCorrect": false
                    }
                  ]
                }
              ]
            },
            {
              "Id": "category_02",
              "Name": "Geografia",
              "Questions": [
                {
                  "Id": "question_01",
                  "Text": "Co jest stolicą Francji",
                  "Answers": [
                    {
                      "Id": "answer_01",
                      "Text": "Budapeszt",
                      "IsCorrect": false
                    },
                    {
                      "Id": "answer_02",
                      "Text": "Warszawa",
                      "IsCorrect": false
                    },
                    {
                      "Id": "answer_03",
                      "Text": "Moskwa",
                      "IsCorrect": false
                    },
                    {
                      "Id": "answer_04",
                      "Text": "Paryż",
                      "IsCorrect": true
                    }
                  ]
                }
              ]
            }
          ]
        },
        {
          "Id": "round_02",
          "Categories": [
            {
              "Id": "category_11",
              "Name": "Rozrywka",
              "Questions": [
                {
                  "Id": "question_01",
                  "Text": "Kto jest prowadzącym programu \"Milionerzy\"?",
                  "Answers": [
                    {
                      "Id": "answer_01",
                      "Text": "Tomasz Kammel",
                      "IsCorrect": false
                    },
                    {
                      "Id": "answer_02",
                      "Text": "Hubert Urbański",
                      "IsCorrect": true
                    },
                    {
                      "Id": "answer_03",
                      "Text": "Piotr Gąsowski",
                      "IsCorrect": false
                    },
                    {
                      "Id": "answer_04",
                      "Text": "Tomasz Marzec",
                      "IsCorrect": false
                    }
                  ]
                }
              ]
            },
            {
              "Id": "category_02",
              "Name": "Historia",
              "Questions": [
                {
                  "Id": "question_01",
                  "Text": "Kiedy wybuchła II wojna światowa?",
                  "Answers": [
                    {
                      "Id": "answer_01",
                      "Text": "1939",
                      "IsCorrect": true
                    },
                    {
                      "Id": "answer_02",
                      "Text": "1940",
                      "IsCorrect": false
                    },
                    {
                      "Id": "answer_03",
                      "Text": "1941",
                      "IsCorrect": false
                    },
                    {
                      "Id": "answer_04",
                      "Text": "1942",
                      "IsCorrect": false
                    }
                  ]
                }
              ]
            }
          ]
        },
        {
          "Id": "round_03",
          "Categories": [
            {
              "Id": "category_11",
              "Name": "Zwierzęta",
              "Questions": [
                {
                  "Id": "question_01",
                  "Text": "Które zwierzę jest największe?",
                  "Answers": [
                    {
                      "Id": "answer_01",
                      "Text": "Słoń",
                      "IsCorrect": true
                    },
                    {
                      "Id": "answer_02",
                      "Text": "Kot",
                      "IsCorrect": false
                    },
                    {
                      "Id": "answer_03",
                      "Text": "Pies",
                      "IsCorrect": false
                    },
                    {
                      "Id": "answer_04",
                      "Text": "Mysz",
                      "IsCorrect": false
                    }
                  ]
                }
              ]
            },
            {
              "Id": "category_02",
              "Name": "Motoryzacja",
              "Questions": [
                {
                  "Id": "question_01",
                  "Text": "Ile koni mechanicznych ma Bugatti Veyron Super Sport?",
                  "Answers": [
                    {
                      "Id": "answer_01",
                      "Text": "1000",
                      "IsCorrect": false
                    },
                    {
                      "Id": "answer_02",
                      "Text": "1200",
                      "IsCorrect": true
                    },
                    {
                      "Id": "answer_03",
                      "Text": "800",
                      "IsCorrect": false
                    },
                    {
                      "Id": "answer_04",
                      "Text": "1500",
                      "IsCorrect": false
                    }
                  ]
                }
              ]
            }
          ]
        },
        {
          "Id": "round_04",
          "Categories": [
            {
              "Id": "category_11",
              "Name": "Gry komputerowe",
              "Questions": [
                {
                  "Id": "question_01",
                  "Text": "Jaki podtytuł ma gra \"The Witcher 2\"?",
                  "Answers": [
                    {
                      "Id": "answer_01",
                      "Text": "Blood and Wine",
                      "IsCorrect": false
                    },
                    {
                      "Id": "answer_02",
                      "Text": "Wild Hunt",
                      "IsCorrect": false
                    },
                    {
                      "Id": "answer_03",
                      "Text": "Assassins of Kings",
                      "IsCorrect": true
                    },
                    {
                      "Id": "answer_04",
                      "Text": "Hearts of Stone",
                      "IsCorrect": false
                    }
                  ]
                }
              ]
            },
            {
              "Id": "category_02",
              "Name": "Polityka",
              "Questions": [
                {
                  "Id": "question_01",
                  "Text": "Kto jest prezydentem Polski?",
                  "Answers": [
                    {
                      "Id": "answer_01",
                      "Text": "Jarosław Kaczyński",
                      "IsCorrect": false
                    },
                    {
                      "Id": "answer_02",
                      "Text": "Andrzej Duda",
                      "IsCorrect": true
                    },
                    {
                      "Id": "answer_03",
                      "Text": "Donald Tusk",
                      "IsCorrect": false
                    },
                    {
                      "Id": "answer_04",
                      "Text": "Lech Wałęsa",
                      "IsCorrect": false
                    }
                  ]
                }
              ]
            }
          ]
        }
      ],
      "Config": {
        "TimeForCategorySelectionMs": 30000,
        "TimeForPowerPlaySelectionMs": 30000,
        "TimeForAnswerSelectionMs": 30000,
        "MaxPointsForAnswer": 400,
        "MinPointsForAnswer": 100,
        "PointsDecrement": 100
      }
    }
  }
]
